{"id":"spawn_rule.tide_quay.vendors","kind":"production_rule","producerArchetypeId":"site_archetype.pirates.tide_quay","actorKind":"vendor","outputDefinitionId":"actor_def.pirates.prize_broker","costs":{"resource.coin":2,"resource.salvage":1,"resource.favor":1},"productionTicks":4,"populationUse":1,"provenanceRequired":true,"initialAssignment":"await_faction_ai_dispatch","requirements":["producer_level_2","market_berth_open"]}
