{
  "id": "spawn_rule.colonial_watch_fort.vendors",
  "kind": "production_rule",
  "producerArchetypeId": "site_archetype.colonial.watch_fort",
  "actorKind": "vendor",
  "outputDefinitionId": "actor_def.colonial.quartermaster",
  "costs": {
    "resource.provisions": 1,
    "resource.timber": 1
  },
  "productionTicks": 900,
  "populationUse": 1,
  "provenanceRequired": true,
  "initialAssignment": "await_faction_ai_dispatch",
  "requirements": [
    "producer_level_2",
    "storehouse_operational"
  ]
}
